cpt_code,cpt_description,avg_payment,national_avg_payment,payment_vs_national,total_services,total_revenue
85610,"Blood test, clotting time",4.193931623930769,,,411.0,1723.36
82626,Dehydroepiandrosterone (dhea) hormone level,24.702800983,,,407.0,10054.04
G2010,"Remote evaluation of recorded video and/or images submitted by an established patient (e.g., store and forward), including interpretation with follow-up with the patient within 24 business hours, not originating from a related e/m service provided within t",9.6371284635,,,397.0,3825.94
J0744,"Injection, ciprofloxacin for intravenous infusion, 200 mg",1.1110789831,,,397.0,438.33
77080,"Dxa bone density measurement of hip, pelvis, spine",31.699645931124998,,,391.0,13563.67
57260,"Plastic repair of vagina and tissue separating vagina, rectum, and bladder",501.3029975531818,417.79900206,20.0,391.0,193340.63
57260,"Plastic repair of vagina and tissue separating vagina, rectum, and bladder",501.3029975531818,435.63315789,15.1,391.0,193340.63
J1955,"Injection, levocarnitine, per 1 gm",19.78375,,,384.0,7596.96
51595,Removal of bladder and lymph nodes on both sides of pelvis with transplantation of ureters to small or large bowel with creation of urinary opening,1684.5132896256002,1450.5628681,16.1,381.0,643047.43
50432,Placement of tube of kidney using imaging guidance with review by radiologist,76.20719295905263,164.30543285,-53.6,374.0,28361.899999999998
50432,Placement of tube of kidney using imaging guidance with review by radiologist,76.20719295905263,517.28427711,-85.3,374.0,28361.899999999998
57267,Insertion of artificial material for pelvic floor defect,197.92161532,,,365.0,72497.4
51102,Aspiration of bladder with insertion of bladder tube to skin,78.25192613627273,118.26039373,-33.8,365.0,27493.84
51102,Aspiration of bladder with insertion of bladder tube to skin,78.25192613627273,173.93600509,-55.0,365.0,27493.84
12001,"Simple repair of surface wound of scalp, neck, underarms, trunk, arms, or legs, 2.5 cm or less",75.191405858,,,358.0,29401.71
77334,Design and construction of complex radiation treatment device,55.882909266000006,,,358.0,19208.96
52318,"Crushing, fragmenting, and removal of bladder stones, more than 2.5 cm",315.60344221956524,409.65794944,-23.0,357.0,109204.15
52318,"Crushing, fragmenting, and removal of bladder stones, more than 2.5 cm",315.60344221956524,344.9701005,-8.5,357.0,109204.15
81514,Measurement of dna of bacteria in vaginal fluid specimen,257.73,,,357.0,92009.61
52276,Incision of urethra using an endoscope,183.71512852857143,258.63757202,-29.0,355.0,64587.43
52276,Incision of urethra using an endoscope,183.71512852857143,156.40572193,17.5,355.0,64587.43
72195,Mri scan of pelvis without contrast,84.68011389244445,,,354.0,31907.309999999998
99283,Emergency department visit with low level of medical decision making,60.57037489099999,,,354.0,21530.16
77336,Continuing radiation therapy consultation per week,60.69344537814286,,,351.0,21072.48
52285,Exam of bladder and urethra for treatment of female urethral syndrome using an endoscope,213.76483107153334,131.44654882,62.6,351.0,77249.12
52285,Exam of bladder and urethra for treatment of female urethral syndrome using an endoscope,213.76483107153334,266.03654077,-19.6,351.0,77249.12
11046,"Removal of muscle and/or tissue, each additional 20.0 sq cm or less",59.868435796499995,,,349.0,20893.6
J2760,"Injection, phentolamine mesylate, up to 5 mg",227.74846955,,,346.0,85660.91
50684,Injection of ureter for imaging,26.414480037300002,23.755485075,11.2,344.0,9035.06
50684,Injection of ureter for imaging,26.414480037300002,71.71925,-63.2,344.0,9035.06
96374,Injection of drug or substance into vein,31.034464818846153,,,338.0,10504.62
87635,Amplifed dna or rna probe detection of severe acute respiratory syndrome coronavirus 2 (covid-19) antigen,49.193920746,,,333.0,16441.56
57240,Repair of bladder hernia into vaginal wall,291.01246576013045,314.89822394,-7.6,330.0,97540.2
57240,Repair of bladder hernia into vaginal wall,291.01246576013045,278.51104938,4.5,330.0,97540.2
76882,Limited ultrasound scan of joint or other extremity structure except blood vessels,30.07279382,,,324.0,10521.97
53899,Other procedure on urinary system,198.64799411153334,,,322.0,71935.61
55880,"High-intensity ultrasound destruction of cancerous tissue in prostate gland, accessed through rectum using ultrasound guidance",777.1549812426316,806.34483491,-3.6,319.0,245793.85
55880,"High-intensity ultrasound destruction of cancerous tissue in prostate gland, accessed through rectum using ultrasound guidance",777.1549812426316,790.8478125,-1.7,319.0,245793.85
99457,"Management using the results of remote vital sign monitoring per calendar month, first 20 minutes",31.56197121375,,,318.0,10925.119999999999
97597,"Removal of tissue from wound, 20.0 sq cm or less",50.672854738,,,318.0,9319.11
52341,Dilation of bladder and urethra using an endoscope,162.27181744285713,247.71948925,-34.5,308.0,49651.45
52341,Dilation of bladder and urethra using an endoscope,162.27181744285713,181.13183673,-10.4,308.0,49651.45
J3420,"Injection, vitamin b-12 cyanocobalamin, up to 1000 mcg",1.2597720797666667,,,301.0,334.57
J2175,"Injection, meperidine hydrochloride, per 100 mg",6.054725675099999,,,299.0,1808.97
57420,Exam of vagina and cervix using an endoscope,53.164530131,,,299.0,15138.86
96413,"Administration of chemotherapy into vein, 1 hour or less",103.63501795777778,,,293.0,30653.2
53601,Subsequent dilation of stricture of urethra in male by passage of dilator,53.0249749444,37.214542857,42.5,292.0,16691.059999999998
53601,Subsequent dilation of stricture of urethra in male by passage of dilator,53.0249749444,61.361557971,-13.6,292.0,16691.059999999998
Q3014,Telehealth originating site facility fee,22.274978145857144,,,286.0,6349.0
88360,"Microscopic genetic analysis of tumor, manual",51.29259811614286,,,284.0,11066.93
99458,"Management using the results of remote vital sign monitoring per calendar month, each additional 20 minutes",27.9306456835,,,279.0,7789.780000000001
95923,Testing of autonomic (sympathetic) nervous system function,111.38077962,,,275.0,29996.3
51785,Needle measurement and recording of electrical activity of muscles at bladder and bowel openings,164.74156287928574,73.040436626,125.5,274.0,50460.119999999995
51785,Needle measurement and recording of electrical activity of muscles at bladder and bowel openings,164.74156287928574,350.30129231,-53.0,274.0,50460.119999999995
55873,Destruction of prostate using imaging guidance,925.6239029214286,1054.8559895,-12.3,273.0,221782.07
55873,Destruction of prostate using imaging guidance,925.6239029214286,3653.756391,-74.7,273.0,221782.07
95921,Testing of autonomic nervous system function and heart rate response to deep breathing,77.08622808766667,,,267.0,20286.07
82157,Androstenedione (hormone) level,28.597,,,263.0,7533.38
80051,"Blood test panel for electrolytes (sodium potassium, chloride, carbon dioxide)",6.832919913428571,,,263.0,1797.55
J7040,"Infusion, normal saline solution, sterile (500 ml = 1 unit)",1.0086972511375,,,260.0,263.26
87045,Stool culture,9.235071428574999,,,258.0,2380.23
76999,Other ultrasound procedure,153.59321084291665,,,258.0,34455.5
74400,Imaging of urinary tract with injection of contrast into a vein,57.32013636375,,,257.0,7488.6900000000005
54360,Surgery to correct abnormal penis angle,281.9061191563637,,,254.0,74738.08
87102,Fungal culture (mold or yeast),8.237833333333333,,,252.0,2075.5699999999997
96373,Injection of drug or substance into artery,16.701264123999998,,,251.0,4056.75
76830,"Ultrasound scan of uterus, ovaries, tubes, cervix and pelvic area through vagina",84.32163896171429,,,251.0,21039.38
55840,Removal of prostate,526.043640525625,464.12761869,13.3,250.0,137838.88
58542,"Partial removal of uterus, tubes, and/or ovaries with retention of cervix using an endoscope, 250.0 g or less",345.06065300700004,,,244.0,81515.43
86800,Thyroglobulin (thyroid protein) antibody measurement,15.439,,,233.0,3621.9
86376,Microsomal antibodies (autoantibody) measurement,14.173472222000001,,,233.0,3316.35
82308,Calcitonin (hormone) level,25.938285714499997,,,233.0,6094.43
84442,Thyroxine binding globulin (thyroid related protein) level,14.3535714285,,,233.0,3364.99
99344,"Residence visit for new patient with moderate level of medical decision making, per day, if using time, at least 60 minutes",110.62287726150001,,,232.0,24459.739999999998
50327,Preparation of donor kidney and veins for transplantation,88.98139318846152,75.704949713,17.5,231.0,20044.12
A9589,"Instillation, hexaminolevulinate hydrochloride, 100 mg",965.2174042942858,,,231.0,223236.75
84432,Thyroglobulin (thyroid related hormone) level,15.662142857,,,230.0,3614.75
99310,"Subsequent nursing facility care with high level of medical decision making, per day, if using time, at least 45 minutes",127.07684740999998,,,229.0,28783.15
87070,"Bacterial culture, any other source except urine, blood or stool, aerobic",8.4875595238,,,227.0,1937.08
93010,Routine electrocardiogram (ecg) using at least 12 leads with interpretation and report only,5.9054468294,,,227.0,1294.5900000000001
A4561,"Pessary, rubber, any type",19.91435619225,,,222.0,4416.04
J1020,"Injection, methylprednisolone acetate, 20 mg",4.1086345979,,,220.0,903.54
83540,Iron level,6.394418604666666,,,220.0,1401.82
83550,Iron binding capacity,8.6192857143,,,215.0,1848.76
G0283,"Electrical stimulation (unattended), to one or more areas for indication(s) other than wound care, as part of a therapy plan of care",9.871176470599998,,,214.0,2187.34
51040,Incision of bladder with drainage,181.95830933357144,213.4867036,-14.8,213.0,39349.3
51040,Incision of bladder with drainage,181.95830933357144,213.56717391,-14.8,213.0,39349.3
99423,"Online digital evaluation and management service for an established patient for up to 7 days, total time 21 or more minutes",35.71436249714286,,,209.0,7606.85
J0692,"Injection, cefepime hydrochloride, 500 mg",0.9838424133666667,,,209.0,205.63
87205,Special gram or giemsa stain for microorganism,4.18,,,208.0,869.44
99497,"Advance care planning, first 30 minutes",74.949086538,,,208.0,15589.41
U0003,"Infectious agent detection by nucleic acid (dna or rna); severe acute respiratory syndrome coronavirus 2 (sars-cov-2) (coronavirus disease [covid-19]), amplified probe technique, making use of high throughput technologies as described by cms-2020-01-r",73.5,,,204.0,14994.0
U0005,"Infectious agent detection by nucleic acid (dna or rna); severe acute respiratory syndrome coronavirus 2 (sars-cov-2) (coronavirus disease [covid-19]), amplified probe technique, cdc or non-cdc, making use of high throughput technologies, completed within",24.5,,,203.0,4973.5
82435,Blood chloride level,4.51,,,201.0,906.51
52275,Incision of urethra in male using an endoscope,474.70530319,227.33222917,108.8,199.0,94510.64
52275,Incision of urethra in male using an endoscope,474.70530319,462.22562327,2.7,199.0,94510.64
G0506,Comprehensive assessment of and care planning for patients requiring chronic care management services (list separately in addition to primary monthly care management service),46.29,,,196.0,9034.84
99422,"Online digital evaluation and management service for an established patient for up to 7 days, total time 11-20 minutes",21.944145013555556,,,196.0,4349.1
J2550,"Injection, promethazine hcl, up to 50 mg",2.4718674075428573,,,195.0,482.9
45990,Diagnostic exam of anus and rectum under anesthesia,43.43620833336364,,,195.0,8443.720000000001
57452,Exam of cervix and upper part of vagina using an endoscope,62.404000272000005,,,195.0,12088.630000000001
J3415,"Injection, pyridoxine hcl, 100 mg",9.26375,,,192.0,1778.64
96127,Assessment of emotional or behavioral problems,3.4776214953249998,,,191.0,603.88
99239,"Hospital discharge day management, more than 30 minutes",92.56189968688889,,,190.0,18042.510000000002
57423,Repair of vaginal defect using an endoscope,352.579413758,,,189.0,65087.14
64910,Repair of nerve with graft,273.76543265285716,,,185.0,52271.41
57283,Repair of prolapsing vaginal vault through vagina,320.2652427825,,,184.0,56780.8
G2252,"Brief communication technology-based service, e.g. virtual check-in, by a physician or other qualified health care professional who can report evaluation and management services, provided to an established patient, not originating from a related e/m servic",22.747738095000003,,,184.0,4370.68
97162,"Evaluation for physical therapy, typically 30 minutes",76.72618220733334,,,184.0,13981.14
G0008,Administration of influenza virus vaccine,25.274625850333333,,,183.0,4624.43
55650,Removal of fluid-producing glands for sperm movement,472.5245646025,,,182.0,87590.12
G0179,"Physician or allowed practitioner re-certification for medicare-covered home health services under a home health plan of care (patient not present), including contacts with home health agency and review of reports of patient status required by physicians a",33.657666666666664,,,181.0,6355.24
84560,Uric acid level,4.910833333333334,,,179.0,881.46
17250,Application of chemical to stop tissue regrowth in wound,44.360109591000004,,,176.0,8535.51
99407,"Smoking and tobacco use intensive counseling, more than 10 minutes",29.33,,,175.0,5132.75
76498,Other mri scan,36.922983944833334,,,175.0,6232.9
50386,Removal of stent in ureter through ureter with review by radiologist,644.9540818963636,115.5325,458.2,174.0,111840.0
50386,Removal of stent in ureter through ureter with review by radiologist,644.9540818963636,652.0015949,-1.1,174.0,111840.0
50605,Insertion of stent in ureter,450.9930860728572,366.06423423,23.2,169.0,73761.87
50605,Insertion of stent in ureter,450.9930860728572,404.57166667,11.5,169.0,73761.87
72192,Ct scan of pelvis without contrast,79.90042582414286,,,169.0,14146.92
J1626,"Injection, granisetron hydrochloride, 100 mcg",0.3045625,,,160.0,48.73
99451,"Telephone, internet, or electronic health record assessment and management with written report by consulting physician, at least 5 minutes",27.0182784159,,,158.0,4275.43
52265,Dilation of bladder using an endoscope,229.86822959057145,124.74253623,84.3,158.0,36241.07
52265,Dilation of bladder using an endoscope,229.86822959057145,296.47963374,-22.5,158.0,36241.07
93981,Ultrasound of penis artery and vein blood flow,57.241166666666665,,,154.0,9180.33
52346,Repair of stricture in kidney with exam of urinary tract using an endoscope,207.80244135499998,345.7907561,-39.9,154.0,32703.230000000003
82962,Blood glucose (sugar) test performed by hand-held instrument,3.1937254902,,,153.0,488.64
49321,Biopsy of abdomen using an endoscope,108.65993961333334,,,152.0,20469.85
82374,Carbon dioxide (bicarbonate) level,4.78,,,152.0,726.5600000000001
82340,Urine calcium level,5.8115000000000006,,,151.0,880.5899999999999
84105,Urine phosphate level,5.56566666666,,,151.0,843.3399999999999
84133,Urine potassium level,4.562666666659999,,,151.0,691.36
84300,Urine sodium level,4.87733333334,,,151.0,739.04
52630,Complete removal of remaining or regrown prostate tissue with control of bleeding using an endoscope,269.406928088,399.59443892,-32.6,147.0,39027.07
52630,Complete removal of remaining or regrown prostate tissue with control of bleeding using an endoscope,269.406928088,308.50590164,-12.7,147.0,39027.07
20553,"Injection of trigger points, 3 or more muscles",41.425625,,,144.0,5965.29
85652,"Red blood cell sedimentation rate, to detect inflammation, automated",2.65,,,144.0,381.59999999999997
55000,Aspiration of fluid collection in testicle and sperm reservoir,91.07235521783333,,,143.0,12919.62
51727,Complex measurement of pressure of urine flow in bladder with urethra pressure studies,141.11178335185713,83.328125,69.3,142.0,17061.05
51727,Complex measurement of pressure of urine flow in bladder with urethra pressure studies,141.11178335185713,200.98960708,-29.8,142.0,17061.05
J2440,"Injection, papaverine hcl, up to 60 mg",29.3166357894,,,141.0,4168.13
56820,Exam of external female genitals using an endoscope,89.10524267266668,,,140.0,14059.829999999998
53454,Adjustment of fluid volume in adjustable balloon continence device beside urethra,22.0252671255,48.05245614,-54.2,140.0,3511.92
53454,Adjustment of fluid volume in adjustable balloon continence device beside urethra,22.0252671255,30.744135338,-28.4,140.0,3511.92
99348,"Residence visit for established patient with low level of medical decision making, per day, if using time, at least 30 minutes",64.1073070175,,,137.0,8720.41
J1720,"Injection, hydrocortisone sodium succinate, up to 100 mg",13.817562211999999,,,136.0,1876.43
77081,"Dxa bone density measurement of forearm, finger, hand, or foot",32.847703704,,,135.0,4434.44
J3360,"Injection, diazepam, up to 5 mg",5.566177510599999,,,134.0,763.73
J1950,"Injection, leuprolide acetate (for depot suspension), per 3.75 mg",18.087651515,,,132.0,2387.57
J7120,"Ringers lactate infusion, up to 1000 cc",1.9200030467200002,,,131.0,251.86
50200,Needle biopsy of kidney,85.7112886312,95.798198584,-10.5,130.0,11302.2
50200,Needle biopsy of kidney,85.7112886312,373.18350877,-77.0,130.0,11302.2
90662,"Influenza vaccine split virus, preservative free",66.4331666666,,,125.0,8335.36
20552,"Injection of trigger points, 1-2 muscles",34.3299331984,,,121.0,3914.04
57065,Extensive destruction of growth of vagina,195.61188034,,,117.0,22886.59
G0102,Prostate cancer screening; digital rectal examination,11.2309333334,6.3802463054,76.0,117.0,1315.71
G0102,Prostate cancer screening; digital rectal examination,11.2309333334,12.957593956,-13.3,117.0,1315.71
98966,"Telephone medical discussion provided by nonphysician professional, 5-10 minutes",10.37739130435,,,116.0,1263.46
88377,"Microscopic genetic analysis of tissue, manual, each additional multiplex stain procedure",250.8177884625,,,113.0,28377.98
P9615,Catheterization for collection of specimen(s) (multiple patients),6.64295,2.9505649466,125.1,112.0,897.39
53855,Insertion of a temporary urethra stent using an endoscope,284.55796230225,169.5125,67.9,112.0,30466.91
53855,Insertion of a temporary urethra stent using an endoscope,284.55796230225,575.68383178,-50.6,112.0,30466.91
52320,Removal of stone in ureter using an endoscope,117.5141377466,184.25221053,-36.2,112.0,13539.130000000001
52320,Removal of stone in ureter using an endoscope,117.5141377466,162.07913043,-27.5,112.0,13539.130000000001
82948,Blood glucose (sugar) measurement using reagent strip,4.94,,,108.0,533.52
57265,Repair of bulging of rectum and bladder into vaginal wall,495.4741505425,505.96336672,-2.1,108.0,59692.28
57265,Repair of bulging of rectum and bladder into vaginal wall,495.4741505425,484.56784314,2.3,108.0,59692.28
J3480,"Injection, potassium chloride, per 2 meq",0.0941904762,,,105.0,9.89
93306,"Ultrasound of heart with color-depicted blood flow, rate, direction and valve function",148.37371429,,,105.0,15579.24
Q2043,"Sipuleucel-t, minimum of 50 million autologous cd54+ cells activated with pap-gm-csf, including leukapheresis and all other preparatory procedures, per infusion",41694.64856533334,,,104.0,4325145.62
J0698,"Injection, cefotaxime sodium, per gm",4.18541266835,,,104.0,426.77
53852,Destruction of prostate tissue using radiofrequency induced heat,812.9419230899999,326.12375,149.3,102.0,103036.25
53852,Destruction of prostate tissue using radiofrequency induced heat,812.9419230899999,1237.9090566,-34.3,102.0,103036.25
38572,Removal of lymph nodes of both sides of pelvis and abdominal lymph node biopsy using an endoscope,293.80786715,,,101.0,29966.98
G0328,"Colorectal cancer screening; fecal occult blood test, immunoassay, 1-3 simultaneous",17.69,,,99.0,1751.31
50592,Destruction of growth of kidney using radiofrequency,272.548896104,267.36779866,1.9,97.0,27135.1
50592,Destruction of growth of kidney using radiofrequency,272.548896104,2023.0252083,-86.5,97.0,27135.1
97810,"Acupuncture, initial 15 minutes",32.828041237,,,97.0,3184.32
97811,"Acupuncture, each additional 15 minutes",24.510103093,,,97.0,2377.48
64585,Revision of peripheral neurostimulator electrodes,161.11320459400002,,,95.0,15749.68
53440,Creation of sling around urethra in male to control leakage,479.6969554316667,1372.572617,-65.1,95.0,44266.96
53440,Creation of sling around urethra in male to control leakage,479.6969554316667,543.34347826,-11.7,95.0,44266.96
74410,Imaging of urinary tract using infusion technique,88.7794794118,,,95.0,8466.08
99454,"Remote monitoring of physiologic parameters, initial supply of devices with daily recordings or programmed alerts transmission, each 30 days",36.225,,,95.0,3615.3
54410,Removal and replacement of multicomponent inflatable penile implant during same surgery,720.8877792133334,,,93.0,67509.3
49905,Repair of abdomen using abdominal lining graft,276.06257138666666,,,93.0,26166.469999999998
72196,Mri scan of pelvis with contrast,57.054332907,,,93.0,5404.75
53600,Initial dilation of urethra in male using dilator,58.487431277666666,39.355077149,48.6,92.0,6002.13
53600,Initial dilation of urethra in male using dilator,58.487431277666666,63.516056423,-7.9,92.0,6002.13
50780,Connection of ureter to bladder,941.11152174,731.75864811,28.6,92.0,86582.26
76881,Complete ultrasound scan of joint,31.013870869,,,88.0,2844.92
93923,Complete ultrasound study of arm and leg arteries,106.19630952425,,,87.0,9704.44
74183,Mri scan of abdomen before and after contrast,190.7397826075,,,84.0,14904.92
15240,"Full thickness skin graft to forehead, cheeks, chin, mouth, neck, underarms, genitals, hands, or feet, 20.0 sq cm or less",347.152857144,,,82.0,28652.510000000002
71270,Ct scan of chest before and after contrast,61.7736031745,,,79.0,4899.55
50430,Injection procedure for imaging of kidney and ureter through new skin access using imaging guidance with review by radiologist,63.663580247,92.67103079,-31.3,79.0,5008.99
50430,Injection procedure for imaging of kidney and ureter through new skin access using imaging guidance with review by radiologist,63.663580247,471.14809524,-86.5,79.0,5008.99
58262,"Removal of uterus, tubes, and/or ovaries through vagina, 250.0 g or less",709.589866666,,,79.0,55160.27
99285,Emergency department visit with high level of medical decision making,143.97724828,,,77.0,11056.36
36247,"Insertion of tube into abdominal, pelvic, or leg artery, initial third order branch",185.11739224,,,77.0,13853.07
82550,"Creatine kinase (cardiac enzyme) level, total",6.38,,,77.0,491.26
74425,Review by radiologist of upper urinary tract image,19.96,,,76.0,1516.96
A4353,"Intermittent urinary catheter, with insertion supplies",7.244666666666666,6.5631014904,10.4,76.0,550.66
50820,Connection of ureter to small bowel with creation of opening from ureter to skin,1263.250252145,866.7558895,45.7,75.0,98370.84
74150,Ct scan of abdomen without contrast,60.7649202906,,,75.0,4272.39
50547,Removal of kidney from living donor using an endoscope,1682.804243425,1259.2490969,33.6,72.0,123799.78
57285,Repair of vaginal wall defect through vagina,337.6421212133333,,,72.0,25190.53
78306,Nuclear medicine study of bone and/or joint whole body,163.9078904425,,,72.0,11916.130000000001
99350,"Residence visit for established patient with high level of medical decision making, per day, if using time, at least 60 minutes",148.17040404,,,71.0,10517.19
50431,Injection procedure for imaging of kidney and ureter through already existing skin access using imaging guidance with review by radiologist,25.4315,45.414539384,-44.0,70.0,1787.18
50431,Injection procedure for imaging of kidney and ureter through already existing skin access using imaging guidance with review by radiologist,25.4315,208.15515695,-87.8,70.0,1787.18
J2370,"Injection, phenylephrine hcl, up to 1 ml",2.30814285715,,,69.0,158.98000000000002
50230,"Removal of kidney, lymph nodes, and/or blood clot from major vein with partial removal of ureter",829.3841818180001,761.33082012,8.9,66.0,56215.259999999995
54231,Assessment of erectile dysfunction including injection of drugs into penis,95.9951515135,,,65.0,6383.17
82248,"Bilirubin level, direct",4.92,,,64.0,314.88
77012,Review by radiologist of ct guidance for needle placement,60.697282608500004,,,63.0,3885.33
10006,"Fine needle aspiration biopsy using ultrasound guidance, each additional growth",50.831073684,,,63.0,3202.85
85007,Microscopic examination for white blood cells with manual cell count,3.72,,,62.0,230.64
91120,Test for tone and sensation of rectum and anus,308.52009259000005,,,62.0,19665.28
99195,Drawing of blood for a medical problem,67.002695652,,,61.0,4330.66
37243,Occlusion of growths or obstructed vessels with review by radiologist,502.33388393,,,60.0,30140.47
52450,Incision of prostate,275.3117513375,440.08170606,-37.4,60.0,16150.89
52450,Incision of prostate,275.3117513375,317.10083333,-13.2,60.0,16150.89
55180,Complicated repair of scrotum,296.4706746033333,,,60.0,18133.25
96160,Administration and interpretation of patient-focused health risk assessment,2.133220339,,,59.0,125.86
11981,Insertion of drug delivery implant into tissue,59.7492708335,,,59.0,4764.68
55150,Removal of diseased or injured scrotum,201.96606944500002,,,58.0,11741.91
50435,Replacement of kidney drainage tube using imaging guidance with review by radiologist,46.079990503333335,85.579117318,-46.2,58.0,2664.33
50435,Replacement of kidney drainage tube using imaging guidance with review by radiologist,46.079990503333335,399.6109272,-88.5,58.0,2664.33
52355,Removal of growth of ureter or kidney using an endoscope,349.1702849,456.38825459,-23.5,57.0,20693.14
52355,Removal of growth of ureter or kidney using an endoscope,349.1702849,351.87588235,-0.8,57.0,20693.14
53447,Removal and replacement of inflatable urethra or bladder neck sphincter,611.5635535725,825.83446352,-25.9,57.0,34382.6
53447,Removal and replacement of inflatable urethra or bladder neck sphincter,611.5635535725,442.11,38.3,57.0,34382.6
97814,"Acupuncture with electrical stimulation, each additional 15 minutes",31.516964286,,,56.0,1764.95
