cpt_code,cpt_description,avg_payment,national_avg_payment,payment_vs_national,total_services,total_revenue
97813,"Acupuncture with electrical stimulation, initial 15 minutes",38.883035714,,,56.0,2177.45
J0290,"Injection, ampicillin sodium, 500 mg",0.6105357143,,,56.0,34.19
15271,"Application of skin substitute graft to wound of trunk, arms, or legs, 25.0 sq cm or less of wound 100.0 sq cm or less",72.16,,,55.0,3968.8
98967,"Telephone medical discussion provided by nonphysician professional, 11-20 minutes",19.881818182,,,55.0,1093.5
77013,Ct guidance for tissue removal,158.435,,,54.0,8673.119999999999
96375,Injection of additional new drug or substance into vein,14.023518519,,,54.0,757.27
50080,Simple surgical treatment of kidney stone with imaging guidance,521.74150436,714.70596622,-27.0,53.0,27542.36
50080,Simple surgical treatment of kidney stone with imaging guidance,521.74150436,636.208,-18.0,53.0,27542.36
50325,Preparation of living donor kidney for transplantation,72.18144927533334,70.041401306,3.1,52.0,3715.4
77078,Ct scan for measuring calcium and other minerals in bone,82.62,,,51.0,4213.62
54300,Repair of curved penis,267.04078431,,,51.0,13619.08
98968,"Telephone medical discussion provided by nonphysician professional, 21-30 minutes",27.578431373,,,51.0,1406.5
G0181,Physician or allowed practitioner supervision of a patient receiving medicare-covered services provided by a participating home health agency (patient not present) requiring complex and multidisciplinary care modalities involving regular physician or allow,79.67875000000001,,,51.0,4028.73
78740,Nuclear medicine study to assess urine flow,90.285,,,49.0,4627.679999999999
90756,"Influenza vaccine, quadrivalent derived from cell cultures",31.00122449,,,49.0,1519.06
57120,Suture closure of vagina and vaginal opening,367.6148383,,,49.0,17694.05
50328,Preparation of donor kidney and arteries for transplantation,74.6497058825,66.205919325,12.8,48.0,3205.38
84132,Blood potassium level,4.66,,,48.0,223.68
84295,Blood sodium level,4.71,,,48.0,226.07999999999998
82803,Blood gases measurement,25.55,,,48.0,1226.4
38570,Biopsy and removal of lymph nodes of abdominal cavity using an endoscope,200.32490196,,,48.0,9648.32
49323,Drainage of lymph fluid to abdominal cavity using an endoscope,132.2425,,,47.0,6213.08
J7030,"Infusion, normal saline solution , 1000 cc",2.0072340426,,,47.0,94.34
J1940,"Injection, furosemide, up to 20 mg",0.4496673387,,,47.0,21.27
74160,Ct scan of abdomen with contrast,118.40731060666667,,,47.0,5492.45
50436,Dilation of existing opening into urinary tract using imaging guidance,60.19625,,,46.0,2768.3
76380,Limited or follow-up ct scan,39.905185185,,,46.0,1842.8
76120,Imaging of organ,89.8660869565,,,46.0,4133.84
52270,Incision of urethra in female using an endoscope,229.8584615385,165.44619403,38.9,45.0,9199.470000000001
52270,Incision of urethra in female using an endoscope,229.8584615385,342.25186047,-32.8,45.0,9199.470000000001
J2405,"Injection, ondansetron hydrochloride, per 1 mg",0.0756818182,,,44.0,3.33
J2543,"Injection, piperacillin sodium/tazobactam sodium, 1 gram/0.125 grams (1.125 grams)",1.0285057471,,,43.5,44.74
55175,Simple repair of scrotum,144.88341026,,,43.0,6094.96
J2310,"Injection, naloxone hydrochloride, per 1 mg",7.3806976744,,,43.0,317.37
49505,Repair of groin hernia (5 years or older),426.22051994333333,,,43.0,18138.190000000002
14040,"Repair of wound of forehead, cheeks, chin, mouth, neck, underarms, genitals, hands, or feet by transferring skin, 10.0 sq cm or less",233.81177719,,,42.0,9697.119999999999
73564,"X-ray of knee, 4 or more views",32.284047619,,,42.0,1355.93
54240,Assessment of penile blood flow,87.97666666666667,,,40.0,3517.54
84478,Triglycerides level,6.02825,,,40.0,241.13
86141,"Measurement c-reactive protein for detection of infection or inflammation, high sensitivity",12.56,,,40.0,502.4
50715,Release of scar tissue at ureter,632.8953832433334,715.53935617,-11.5,39.0,22933.510000000002
99448,"Telephone or internet assessment with verbal and written report by consulting physician, 21-30 minutes",36.057435897,,,39.0,1406.24
53450,Repair of urethra and urinary opening,152.84,357.34138047,-57.2,38.0,5807.92
53450,Repair of urethra and urinary opening,152.84,315.50384615,-51.6,38.0,5807.92
81050,Urine volume measurement,3.4212499999999997,,,38.0,128.52
84436,"Thyroxine (thyroid chemical), total",6.73,,,38.0,255.74
84479,Thyroid hormone evaluation,6.34,,,38.0,240.92000000000002
82436,Urine chloride level,5.39541666665,,,38.0,202.68
53451,Insertion of adjustable balloon continence device on both sides of urethra using imaging guidance,608.25972973,2711.30125,-77.6,37.0,22505.61
83721,Ldl cholesterol level,10.525135135,,,37.0,389.43
A9503,"Technetium tc-99m medronate, diagnostic, per study dose, up to 30 millicuries",32.4226923075,,,37.0,1398.58
99282,Emergency department visit with straightforward medical decision making,36.01948717933333,,,37.0,1324.96
94010,Test to measure expiratory airflow and volume,19.34,,,37.0,715.58
95115,Professional service for single injection of allergen,7.77,,,37.0,287.49
10005,"Fine needle aspiration biopsy using ultrasound guidance, first growth",57.14,,,37.0,2114.38
83090,Homocysteine (amino acid) level,17.572777778,,,36.0,632.62
76937,Ultrasonic guidance for blood vessel access,12.3216666665,,,36.0,453.32
82271,Specimen analysis for blood,5.21,,,35.0,182.35
99483,"Assessment of and care planning for patient with impaired thought processing, typically 60 minutes",235.96,,,35.0,8258.6
50329,Preparation of donor kidney and ureter for transplantation,53.522857143,54.758155844,-2.3,35.0,1873.3
52345,Repair of stricture of upper attachment of ureter to kidney using an endoscope,130.544172933,286.5817506,-54.4,33.0,4483.15
50433,Placement of tube of kidney and urinary tube through new skin access using imaging guidance with review by radiologist,99.745,198.10392118,-49.7,33.0,3268.11
50433,Placement of tube of kidney and urinary tube through new skin access using imaging guidance with review by radiologist,99.745,635.02976744,-84.3,33.0,3268.11
A9562,"Technetium tc-99m mertiatide, diagnostic, per study dose, up to 15 millicuries",412.11625000000004,,,32.0,13187.720000000001
J1030,"Injection, methylprednisolone acetate, 40 mg",5.8625,,,32.0,187.6
44700,Suspension of small bowel using mesh or prosthesis or self tissue,449.10623016,,,32.0,14667.05
G0396,"Alcohol and/or substance (other than tobacco) misuse structured assessment (e.g., audit, dast), and brief intervention 15 to 30 minutes",21.2090625,,,32.0,678.69
87510,"Detection test for gardnerella vaginalis (bacteria), direct probe technique",19.65,,,32.0,628.8
45560,Repair of bulging of rectum into vagina,296.310333335,,,32.0,9845.02
87660,"Detection test by nucleic acid for trichomonas vaginalis (genital parasite), direct probe technique",19.65,,,32.0,628.8
87480,"Detection test for candida species (yeast), direct probe technique",19.65,,,32.0,628.8
53265,Removal or destruction of growth of urethra,168.795,201.51695761,-16.2,32.0,5401.44
53265,Removal or destruction of growth of urethra,168.795,85.415542571,97.6,32.0,5401.44
10011,"Fine needle aspiration biopsy of growth using mri guidance, first growth",366.94500000000005,,,31.0,11427.970000000001
54110,Removal of thickened tissue of penis,410.735,,,31.0,13417.310000000001
99236,"Initial hospital care with same-day admission and discharge with high level of medical decision making, per day, if using time, at least 85 minutes",169.41818182,,,31.0,5298.42
93880,Ultrasound of both sides of head and neck blood flow,140.068886555,,,31.0,4380.95
A9552,"Fluorodeoxyglucose f-18 fdg, diagnostic, per study dose, up to 45 millicuries",152.62666667,,,30.0,4578.8
50385,Removal and replacement of stent in ureter through urethra with review by radiologist,988.055,178.37458515,453.9,30.0,29641.65
50385,Removal and replacement of stent in ureter through urethra with review by radiologist,988.055,1013.8504167,-2.5,30.0,29641.65
J0713,"Injection, ceftazidime, per 500 mg",1.369,,,30.0,41.07
J7326,"Hyaluronan or derivative, gel-one, for intra-articular injection, per dose",406.25066667,,,30.0,12187.52
54161,Removal of foreskin (older than 28 days),141.87409502,,,30.0,4240.19
52500,Removal of bladder neck through urethra,361.30752381,465.30486436,-22.4,29.0,10490.35
52500,Removal of bladder neck through urethra,361.30752381,374.23756757,-3.5,29.0,10490.35
95117,Professional service for multiple injections of allergen,9.06,,,29.0,262.74
72194,Ct scan of pelvis before and after contrast,81.99716577699999,,,28.0,2084.54
27045,"Removal of growth of muscle of pelvis and hip, 5.0 cm or more",527.765,,,28.0,14777.42
51045,Incision of bladder with insertion of tube or stent in ureter,118.269820511,251.79124528,-53.0,28.0,3482.5699999999997
15860,Injection of agent into vein to assess blood flow of skin graft or flap,42.870000000000005,,,28.0,1200.36
99091,"Collection and interpretation of physical parameters stored in computers and/or transmitted by the patient and/or caregiver to qualified health care professional, requiring 30 minutes or more, per 30 days",42.77,,,28.0,1197.56
72170,"X-ray of pelvis, 1-2 views",21.96728022,,,27.0,592.81
99235,"Initial hospital care with same-day admission and discharge with moderate level of medical decision making, per day, if using time, at least 70 minutes",118.52375,,,27.0,3184.26
82105,"Alpha-fetoprotein (afp) level, serum",16.678518519,,,27.0,450.32
49422,Removal of abdominal cavity tube,166.88468749999998,,,27.0,4481.76
50389,Removal of kidney drainage tube using fluoroscopic guidance,23.8407142855,40.110865519,-40.6,26.0,624.98
50389,Removal of kidney drainage tube using fluoroscopic guidance,23.8407142855,299.70223776,-92.0,26.0,624.98
50561,Removal of foreign body or stone in kidney using an endoscope inserted through surgically created opening from kidney to skin,235.715535715,281.94620155,-16.4,26.0,6246.48
58571,"Removal of uterus, tubes, and/or ovaries through abdomen using an endoscope, 250.0 g or less",408.80430303,,,26.0,10582.34
J3370,"Injection, vancomycin hcl, 500 mg",1.9330769231,,,26.0,50.26
73562,"X-ray of knee, 3 views",33.68,,,25.0,842.0
55821,Partial removal of prostate (suprapubic),582.9412662350001,518.74362248,12.4,25.0,14360.02
99234,"Initial hospital care with same-day admission and discharge with straightforward or low level of medical decision making, per day, if using time, at least 45 minutes",74.9842857145,,,25.0,1866.97
J2371,"Injection, phenylephrine hydrochloride, 20 micrograms",0.01,,,25.0,0.25
53410,Reconstruction of urethra in male,793.459675325,705.38150063,12.5,25.0,19791.93
53410,Reconstruction of urethra in male,793.459675325,672.66,18.0,25.0,19791.93
G0316,Prolonged hospital inpatient or observation care evaluation and management service(s) beyond the total time for the primary service (when the primary service has been selected using time on the date of the primary service); each additional 15 minutes by th,23.3824,,,25.0,584.56
64595,Revision of peripheral or gastric neurostimulator generator,51.3977272725,,,24.0,1233.9899999999998
52283,Steroid injection into urethra stricture using an endoscope,109.40388111749999,159.60930667,-31.5,24.0,2695.05
52283,Steroid injection into urethra stricture using an endoscope,109.40388111749999,230.31771429,-52.5,24.0,2695.05
57287,Removal or revision of incontinence sling,589.40153846,560.79162749,5.1,24.0,14148.04
57287,Removal or revision of incontinence sling,589.40153846,510.25460317,15.5,24.0,14148.04
97161,"Evaluation for physical therapy, typically 20 minutes",73.609166667,,,24.0,1766.62
J0694,"Injection, cefoxitin sodium, 1 gm",3.94625,,,24.0,94.71
38780,Removal of lymph nodes of abdominal cavity,437.3043007,,,24.0,10407.71
73580,Review by radiologist of knee joint image,98.973913043,,,23.0,2276.4
88307,"Pathology examination of tissue using a microscope, moderately high complexity",157.64,,,23.0,3625.72
0499T,Cysto f/urtl strix/stenosis,106.7163636365,131.3261039,-18.7,23.0,2466.9700000000003
27369,Injection of contrast for imaging of knee joint,118.07043478,,,23.0,2715.62
50546,Removal of kidney and partial removal of ureter using an endoscope,970.42590909,763.9795284,27.0,23.0,22304.949999999997
50548,Removal of kidney and ureter using an endoscope,1172.09261365,838.85783937,39.7,23.0,27030.16
54220,Injection of drug into erectile tissue at sides and back of penis,170.21791666500002,,,23.0,3891.6
15777,Implantation of biologic implant to soft tissue,179.96,,,21.0,3779.16
95012,Test to measure the level of nitric oxide gas,17.35,,,21.0,364.35
82985,Glycated protein level,16.42,,,21.0,344.82
87811,Detection test by immunoassay with direct visual observation for severe acute respiratory syndrome coronavirus 2 (covid-19),40.55,,,20.0,811.0
54250,Assessment of nighttime erection,92.23,,,20.0,1844.6
G9487,"Remote in-home visit for the evaluation and management of an established patient for use only in a medicare-approved cms innovation center demonstration project, which requires at least 2 of the following 3 key components: an expanded problem focused histo",27.021052632,,,19.0,513.4
77290,"Obtaining data needed to develop the optimal radiation treatment, 3 or more treatment areas or any number of treatment areas where special treatment is involved",72.12,,,19.0,1370.28
58541,"Partial removal of uterus with retention of cervix using an endoscope, 250.0 g or less",285.2,,,18.0,5133.6
50387,Removal and replacement of stent in kidney and ureter using fluoroscopic guidance with review by radiologist,36.342222222,69.764047337,-47.9,18.0,654.16
50387,Removal and replacement of stent in kidney and ureter using fluoroscopic guidance with review by radiologist,36.342222222,282.33538462,-87.1,18.0,654.16
00731,"Anesthesia for other procedure on esophagus, stomach, or upper small bowel using an endoscope",63.086666667,,,18.0,1135.56
10012,"Fine needle aspiration biopsy of growth using mri guidance, each additional growth",198.45,,,17.0,3373.65
45910,Dilation of narrowing of rectum under anesthesia,153.84705882,,,17.0,2615.4
53500,Release of scar tissue of urethra using an endoscope,511.49058824,362.30145497,41.2,17.0,8695.34
72110,"X-ray of lower and sacral spine, minimum of 4 views",23.38,,,17.0,397.46
53449,Repair of inflatable urethra or bladder neck sphincter,491.69352941,522.68606897,-5.9,17.0,8358.79
86140,Measurement c-reactive protein for detection of infection or inflammation,5.08,,,16.0,81.28
78709,"Nuclear medicine studies of kidney, blood flow, and function",268.24,51.116211031,424.8,16.0,4291.84
78709,"Nuclear medicine studies of kidney, blood flow, and function",268.24,239.40012719,12.0,16.0,4291.84
78708,"Nuclear medicine study of kidney, blood, flow, and function with drug administration",89.28,44.08165178,102.5,16.0,1428.48
78708,"Nuclear medicine study of kidney, blood, flow, and function with drug administration",89.28,117.86280702,-24.3,16.0,1428.48
78445,Nuclear medicine study of non-cardiac blood flow,18.48,,,16.0,295.68
64913,"Repair of nerve using nerve graft, each additional strand",143.85,,,16.0,2301.6
49329,Other procedure on abdomen using an endoscope,298.115625,,,16.0,4769.85
J9150,"Injection, daunorubicin, 10 mg",31.784375,,,16.0,508.55
64912,"Repair of nerve using nerve graft, first strand",385.49,,,16.0,6167.84
52300,Removal or destruction of abnormal pouches of ureter at bladder using an endoscope,216.329375,206.34979424,4.8,16.0,3461.27
53665,Dilation of urethra in female under general or spinal anesthesia,14.3,144.419,-90.1,15.0,214.5
53665,Dilation of urethra in female under general or spinal anesthesia,14.3,28.371666667,-49.6,15.0,214.5
99449,"Telephone or internet assessment with verbal and written report by consulting physician, more than 30 minutes",51.182,,,15.0,767.73
51596,Removal of bladder and lymph nodes on both sides of pelvis with transplantation of ureters to small and/or large bowel with creation of urinary opening,1970.6,1681.3039759,17.2,15.0,29559.0
95925,Placement of skin electrodes and measurement of stimulated sites in arms,166.68,,,15.0,2500.2
38562,Partial removal of pelvic and aortic lymph nodes,351.57,,,15.0,5273.55
95806,"Sleep study including heart rate, breathing, airflow, and effort",70.888,,,15.0,1063.32
50240,Partial removal of kidney,1073.6226667,830.72943372,29.2,15.0,16104.34
97535,"Training for self-care or home management, each 15 minutes",25.34,,,14.0,354.76
53620,Initial dilation of urethra in male using filiform dilator,61.26,67.08366443,-8.7,14.0,857.64
53620,Initial dilation of urethra in male using filiform dilator,61.26,129.69554313,-52.8,14.0,857.64
96366,"Infusion into a vein for therapy, prevention, or diagnosis, each additional hour",16.02,,,14.0,224.28
52334,Insertion of guide wire through kidney into ureter using an endoscope,61.337857143,171.57098361,-64.2,14.0,858.73
55865,Exposure of prostate gland for radiation therapy with removal of surrounding lymph nodes on both sides of pelvis,1055.6878571,1082.6,-2.5,14.0,14779.63
50575,Dilation and ureter stent insertion using an endoscope,656.86285714,539.29509804,21.8,14.0,9196.08
64911,Repair of nerve using vein graft,437.84,,,13.0,5691.92
G0182,"Physician supervision of a patient under a medicare-approved hospice (patient not present) requiring complex and multidisciplinary care modalities involving regular physician development and/or revision of care plans, review of subsequent reports of patien",25.590769231,,,13.0,332.68
50551,Exam of kidney using an endoscope inserted through surgically created opening from kidney to skin,215.36307692,204.76638655,5.2,13.0,2799.72
77790,"Supervision, handling, and loading of radiation source",12.98,,,13.0,168.74
44120,Partial removal of small bowel with reconnection,494.02076923,,,13.0,6422.27
36561,Insertion of central venous tube with port (5 years or older),266.98,,,13.0,3470.74
77470,Special radiation treatment,84.11,,,13.0,1093.43
77295,3d radiation therapy planning,365.64,,,13.0,4753.32
77001,Fluoroscopic guidance for insertion or removal of central vein access device,14.39,,,13.0,187.07
93457,"Insertion of tube in right heart chambers, coronary artery, and bypass graft for diagnosis with review by radiologist",3.92,,,13.0,50.96
51860,"Suture of simple wound, injury, or rupture of bladder",313.71846154,405.59907298,-22.7,13.0,4078.34
52290,Incision of ureter using an endoscope,120.46461538,155.09017857,-22.3,13.0,1566.04
52290,Incision of ureter using an endoscope,120.46461538,137.41666667,-12.3,13.0,1566.04
57220,Plastic repair of muscles at urinary opening through vagina,143.25230769,,,13.0,1862.28
14041,"Repair of wound of forehead, cheeks, chin, mouth, neck, underarms, genitals, hands, or feet by transferring skin, 10.1-30.0 sq cm",428.92,,,12.0,5147.04
93925,Ultrasound of leg arteries or artery grafts,160.38333333,,,12.0,1924.6
50945,Removal of stone from ureter using an endoscope,863.4775,651.59918919,32.5,12.0,10361.73
57280,Attachment of vagina to rear pelvic bone,708.07083333,,,12.0,8496.85
99447,"Telephone or internet assessment with verbal and written report by consulting physician, 11-20 minutes",25.35,,,12.0,304.2
50949,Other procedure on ureter using an endoscope,886.96333333,868.6166985,2.1,12.0,10643.56
50690,Injection of bladder and ureter for imaging,92.048333333,47.971078947,91.9,12.0,1104.58
50690,Injection of bladder and ureter for imaging,92.048333333,84.845837838,8.5,12.0,1104.58
55845,Removal of prostate gland and surrounding lymph nodes on both sides of pelvis through abdominal incision,571.33,793.78348653,-28.0,12.0,6855.96
44005,Release of intestinal scar tissue,817.13833333,,,12.0,9805.66
97164,"Re-evaluation for physical therapy, typically 20 minutes",44.299166667,,,12.0,531.59
G0500,"Moderate sedation services provided by the same physician or other qualified health care professional performing a gastrointestinal endoscopic service that sedation supports, requiring the presence of an independent trained observer to assist in the monito",4.12,,,12.0,49.44
55842,Removal of prostate gland and lymph node biopsy through abdominal incision,993.0,775.774,28.0,12.0,11916.0
14301,"Repair of wound by transferring skin, 30.1-60.0 sq cm",651.27666667,,,12.0,7815.32
55110,Search of scrotum,157.52,,,12.0,1890.24
54111,"Removal of abnormally thickened tissue in penis with graft, 5.0 cm or less",368.2275,,,12.0,4418.73
87109,Mycoplasma culture,15.08,,,12.0,180.96
G9488,"Remote in-home visit for the evaluation and management of an established patient for use only in a medicare-approved cms innovation center demonstration project, which requires at least 2 of the following 3 key components: a detailed history; a detailed ex",42.221666667,,,12.0,506.66
10035,"Placement of soft tissue locating device using x-ray, first growth",258.10181818,,,11.0,2839.12
87624,"Detection test by nucleic acid for human papillomavirus (hpv), high-risk types",34.39,,,11.0,378.29
15574,"Creation of flap graft to forehead, cheeks, chin, mouth, neck, underarms, genitals, hands, or feet",296.53636364,,,11.0,3261.9
50541,Destruction of cyst of kidney using an endoscope,382.99727273,455.74616872,-16.0,11.0,4212.97
00811,Anesthesia for other procedure on large bowel using an endoscope,61.286363636,,,11.0,674.15
87880,"Detection test by immunoassay with direct visual observation for streptococcus, group a (strep)",16.2,,,11.0,178.2
33508,Harvest of vein using an endoscope,1.97,,,11.0,21.67
73502,"X-ray of hip, 2-3 views",21.96,,,11.0,241.56
J1040,"Injection, methylprednisolone acetate, 80 mg",9.94,,,11.0,109.34
70200,"X-ray of eye socket, minimum of 4 views",23.663636364,,,11.0,260.3
50694,Placement of stent of ureter through new skin access using imaging guidance with review by radiologist,114.96818182,210.35332808,-45.3,11.0,1264.65
53415,Reconstruction or repair of urethra,1004.24,769.91551429,30.4,11.0,11046.64
50010,Exploration of kidney,330.94272727,358.75892308,-7.8,11.0,3640.37
95938,Placement of skin electrodes and measurement of stimulated sites on arms and legs,257.66,,,11.0,2834.26
57270,Repair of protrusion of intestine into rectum or vagina through abdomen,292.96,,,11.0,3222.56
57110,Removal of vaginal wall,767.65,,,11.0,8444.15
57106,Partial removal of vaginal wall,240.3,,,11.0,2643.3
45150,Incision of stricture of rectum,277.30090909,,,11.0,3050.31
49650,Repair of groin hernia using an endoscope,180.26090909,,,11.0,1982.87
55600,Incision or puncture of fluid-producing gland for sperm movement,388.27909091,,,11.0,4271.07
51590,Removal of bladder with transplantation of ureters to small or large bowel with creation of urinary opening,1445.8018182,1203.2919141,20.2,11.0,15903.82
J0295,"Injection, ampicillin sodium/sulbactam sodium, per 1.5 gm",1.6290909091,,,11.0,17.92
